,Group,User1,User2,Talker 1 Message 1,Talker 2 Message 1,Talker 1 Message 2,Talker 2 Message 2,Talker 1 Message 3,Talker 2 Message 3,Talker 1 Message 4,Talker 2 Message 4,Talker 1 Message 5,Talker 2 Message 5,Talker 1 Message 6,Talker 2 Message 6,Talker 1 Message 7,Talker 2 Message 7,Talker 1 Message 8,Talker 2 Message 8,Talker 1 Message 9,Talker 2 Message 9,Talker 1 Message 10,Talker 2 Message 10,Talker 1 Message 11,Talker 2 Message 11,Talker 1 Message 12,Talker 2 Message 12,Talker 1 Message 13,Talker 2 Message 13,Talker 1 Message 14,Talker 2 Message 14,Talker 1 Message 15,Talker 2 Message 15,Talker 1 Message 16,Talker 2 Message 16,Talker 1 Message 17,Talker 2 Message 17,Talker 1 Message 18,Talker 2 Message 18,Talker 1 Message 19,Talker 2 Message 19,Talker 1 Message 20,Talker 2 Message 20,Talker 1 Message 21,Talker 2 Message 21,Talker 1 Message 22,Talker 2 Message 22,Talker 1 Message 23,Talker 2 Message 23,Talker 1 Message 24,Talker 2 Message 24,Talker 1 Message 25,Talker 2 Message 25,Talker 1 Message 26,Talker 2 Message 26,Talker 1 Message 27,Talker 2 Message 27,Talker 1 Message 28,Talker 2 Message 28,Talker 1 Message 29,Talker 2 Message 29,Talker 1 Message 30,Talker 2 Message 30,Talker 1 Message 31,Talker 2 Message 31,Talker 1 Message 32,Talker 2 Message 32,Talker 1 Message 33,Talker 2 Message 33,Talker 1 Message 34,Talker 2 Message 34,Talker 1 Message 35,Talker 2 Message 35,Talker 1 Message 36,Talker 2 Message 36,Talker 1 Message 37,Talker 2 Message 37,Talker 1 Message 38,Talker 2 Message 38,Talker 1 Message 39,Talker 2 Message 39,Talker 1 Message 40,Talker 2 Message 40,Talker 1 Message 41,Talker 2 Message 41,Talker 1 Message 42,Talker 2 Message 42,Talker 1 Message 43,Talker 2 Message 43,Talker 1 Message 44,Talker 2 Message 44,Talker 1 Message 45,Talker 2 Message 45,Talker 1 Message 46,Talker 2 Message 46,Talker 1 Message 47,Talker 2 Message 47,Talker 1 Message 48,Talker 2 Message 48,Talker 1 Message 49,Talker 2 Message 49,Talker 1 Message 50,Talker 2 Message 50,Talker 1 Message 51,Talker 2 Message 51,Talker 1 Message 52,Talker 2 Message 52,Talker 1 Message 53,Talker 2 Message 53,Talker 1 Message 54,Talker 2 Message 54,Talker 1 Message 55,Talker 2 Message 55,Talker 1 Message 56,Talker 2 Message 56,Talker 1 Message 57,Talker 2 Message 57,Talker 1 Message 58,Talker 2 Message 58,Talker 1 Message 59,Talker 2 Message 59,Talker 1 Message 60,Talker 2 Message 60,Talker 1 Message 61,Talker 2 Message 61,Talker 1 Message 62,Talker 2 Message 62,Talker 1 Message 63,Talker 2 Message 63,Talker 1 Message 64,Talker 2 Message 64,Talker 1 Message 65,Talker 2 Message 65,Talker 1 Message 66,Talker 2 Message 66,Talker 1 Message 67,Talker 2 Message 67,Talker 1 Message 68,Talker 2 Message 68,Talker 1 Message 69,Talker 2 Message 69,Talker 1 Message 70,Talker 2 Message 70,Talker 1 Message 71,Talker 2 Message 71,Talker 1 Message 72,Talker 2 Message 72,Talker 1 Message 73,Talker 2 Message 73,Talker 1 Message 74,Talker 2 Message 74,Talker 1 Message 75,Talker 2 Message 75
0,15,R_1oI9qXx57NF2GGx,R_1OGYjrZMYKdLJF1,test6 ,tst7,NA,NA,NA,NA,NA,NA,NA,NA,NA,NA,NA,NA,NA,NA,NA,NA,NA,NA,NA,NA,NA,NA,NA,NA,NA,NA,NA,NA,NA,NA,NA,NA,NA,NA,NA,NA,NA,NA,NA,NA,NA,NA,NA,NA,NA,NA,NA,NA,NA,NA,NA,NA,NA,NA,NA,NA,NA,NA,NA,NA,NA,NA,NA,NA,NA,NA,NA,NA,NA,NA,NA,NA,NA,NA,NA,NA,NA,NA,NA,NA,NA,NA,NA,NA,NA,NA,NA,NA,NA,NA,NA,NA,NA,NA,NA,NA,NA,NA,NA,NA,NA,NA,NA,NA,NA,NA,NA,NA,NA,NA,NA,NA,NA,NA,NA,NA,NA,NA,NA,NA,NA,NA,NA,NA,NA,NA,NA,NA,NA,NA,NA,NA,NA,NA,NA,NA,NA,NA,NA,NA,NA,NA,NA,NA,NA,NA,NA,NA
1,18,R_1FxnNs0BAJvIWs6,R_2pKaRCbd4e2ULL9,"Given	   the	   choice	    of	   anyone	   in	   the	   world,	   whom	   would	   you	   want	   as	   a	   dinner cc guest? ",eleanor rosevelt? ,"obama :grin:What  would  constitute  a  ""perfect""  day  for you? ",not having to worry about anythingbasically just eating and sleeping ,"sleepingIf	   you	   were	   able	   to	   live	   to	   the	   age	   of	   90	   and	   retain	   either	   the	   mind	   or	   body	   of	   a	   30 -­‐ year -­‐ old	    for	   the	   last	   60	   years	   of	   your	   life,	   which	   would	   you	    want? ","If	   you	   were	   able	   to	   live	   to	   the	   age	   of	   90	   and	   retain	   either	   the	   mind	   or	   body	   of	   a	   30 -­‐ year -­‐ old	    for	   the	   last	   60	   years	   of	   your	   life,	   which	   would	   you	    want?",mind,body,because 30 is old already,"If  you  could  change  anything  about  the  way  you  were  raised,  what  wouyou change ",travel more,spend more time together as a family,"If  you  could  change  anything  about  the  way  you  were  raised,  what  would youchange?If  you  could  wake  up  tomorrow  having  gained  any  one  quality  or  ability,  what ","If  you  could  wake  up  tomorrow  having  gained  any  one  quality  or  ability,  what",copying doesnt workinvisibility ,"reading mindsf	   a	   crystal	   ball	   could	   tell	   you	   the	   truth	   about	   yourself,	   your	   life,	   the	   fu ture,	   or	   anything	   else,	    what	   would	   you	   want	   to	   know ","If	   a	   crystal	   ball	   could	   tell	   you	   the	   truth	   about	   yourself,	   your	   life,	   the	   fu ture,	   or	   anything	   else,	    what	   would	   you	   want	   to	   know?how rich I will be in the future ",i dont want to know,What	   is	   the	   greatest	   accomplishment	   of	   your	life?,going to a college far away from home and being independent,getting a job,What  is  your  most  treasuredmemory doing dumb things with my friends lol ,"uhhsuddenly wanting to visit my grandma one day and then 2 mo later, she passed away that was dark "," :worried:If	   you	   knew	   that	   in	   one	   year	   you	   would	   die	   suddenly,	   would	   you	   change	   anything	   about	   the	    way	   you	   are now	   living?	   Why ",UHGo to more places in cali ,i would quit school and just do whatever i want,and visitand travel ,How  do  you  feel  about  your  relationship  with  yourmother ,great i thinkHow  do  you  feel  about  your  relationship  with  your mother? ,yeah mine is pretty great tooShare	   with	   your	   partner	   an	   embarrassing	   moment	   in	   y your life ,i got hit by bird poop while walking from my car to my highschoolit was literally a 3 minute walk.. ,i managed to fall down 2 flights of stairs,Share  with  your  partner  an  embarrassing  moment  in  your life?,in high schoolWhen  did  you  last  cry  in  front  of  another  person?  By  yourself? ,watching titanic..with 2 friends during a summer in Boston When did you last cry in front of another person? By yourself? ,"i dont really cry in front of people lol i dont really remember to be honest ....If	   you	   were	   to	   die	   this	   e vening	   with	   no	   opportunity	   to	   communicate	   with	   anyone,	   what	    would	   you	   most	   regret	   not	   having	   told	   someone?	   Why	   haven't	   you	   told	   them? ","telling all my friends that I really appreciate them around me. cause it's weridIf	   you	   were	   to	   die	   this	   e vening	   with	   no	   opportunity	   to	   communicate	   with	   anyone,	   what	    would	   you	   most	   regret	   not	   having	   told	   someone?	   Why	   haven't	   you	   told	   them? ","telling my parents how grateful i am for their constant supportYour	   house,	   containing	   everything	   you	   own,	   catches	   fire.	   After	   saving	   your	   loved	   ones	   and	    pets,	   you	   have	   time	   to	    safely	   make	   a	   final	   dash	   to	   save	   any	   one	   item.	   What	   would	   it	   be?	    Why? ","The letters/cards that important people have sent meYour house, containing everything you own, catches fire. After saving your loved ones and pets, you have time to safely make a final dash to save any one item. What would it be? Why? ",pictures,"Of	   all	   the	   people	   in	   your	   family, whose	   death	   would	   you	   find	   most	   disturbing?","grandparents because i am really close with themOf	   all	   the	   people	   in	   your	   family, whose	   death	   would	   you	   find	   most	   disturbing? ",mom probi think that's it bye carmen :) ,NA,NA,NA,NA,NA,NA,NA,NA,NA,NA,NA,NA,NA,NA,NA,NA,NA,NA,NA,NA,NA,NA,NA,NA,NA,NA,NA,NA,NA,NA,NA,NA,NA,NA,NA,NA,NA,NA,NA,NA,NA,NA,NA,NA,NA,NA,NA,NA,NA,NA,NA,NA,NA,NA,NA,NA,NA,NA,NA,NA,NA,NA,NA,NA,NA,NA,NA,NA,NA,NA,NA,NA,NA,NA,NA,NA,NA,NA,NA,NA,NA,NA,NA,NA,NA,NA,NA,NA,NA,NA,NA,NA,NA,NA,NA,NA,NA,NA,NA,NA,NA,NA,NA,NA,NA,NA,NA
2,23,R_1lot6Cpd5pS0Bby,R_3EiIUrOQ02G0uyP,"Given the choice of anyone in the world, whom would you want as a dinner guest? ",If I had the choice to have dinner with anyone in the world I would like it to be with Selena,Who is Selena?,"She is the queen of cumbia. What would you constitute as a ""perfect day""?","Sightseeing in a different country and eating good food. What would you constitute as a ""perfect day?""","A perfect day for me would be to simply enjoy nature on a sunny warm day :) If you were able to live to the age of 90 and retain either the mind or body of a 30-year old for the last 60 years of your life, which would you pick?",I would want to retain the ody of a 30 year oldbody* Which would you pick? ,"jaja.. so you would rather look young but still carry your wisdom? Interesting. I think I would want to have the mind of a 30 year old because I'd like to feel free spirited and optimisticIf you could change anything about the way you were raised, what would it be? ",I wish I had siblings growing up. What would you change?,I would have liked to have grown up closer to my cousins and family... and would have wanted to not be scared,"If you could wake up tomorrow having gained any one quality or ability, what would it be?","I would like to be a mind reader! I always wonder what people are thinking, and would like to read them :scream:what about you ? ","I agreeIf a crystal ball could tell you the truth about yourself, your life, the  future, or anything else , what would you want to know? ","Nothing. I'd rather live not nowing and build  my future, rather than know where I will end up?How about you? ",I would want to know if my birth parents are still alive. What is the greatest accomplishment of your life?,"College, coming to Berkeley, being a Haas majorWhat is your most trasured memory? ",My greatest accomplishment is getting into Cal on an athletic scholarship. My most treasured memory is spending summers in Ireland with my family. What about you?,"every visit to Mexico, every Christmas with my family","if you knew that in one year you would die suddenly, would you change any way you are now living? Why?",I would probably tell more people how much I love them and appreciate themyou? ,"That, and I would want to travel instead of be in school. How do you feel about your relationship with your mother?",Agreed. I love my mother. I see her as  sister or even as a friend more so than a motherhow about yours? ,I'm very close with my mom. But I dont consider her a sister.An embarrassing moment in my life was when I ripped my pants in Kindergarten ,jajaja! when I was chased by a dog in elementary school,when did you last cry in front of another person? by yourself?,when did you last cry? in fornt of someone? by yourself?,I cried in front of my boyfriend probably a few months ago. What about you,"I cried in front of my boyfriend as well.If	   you	   were	   to	   die	   this	   e vening	   with	   no	   opportunity	   to	   communicate	   with	   anyone,	   what	    would	   you	   most	   regret	   not	   having	   told	   someone?	   Why	   haven't	   you	   to told someone? and why? ",Probably my mom and dad and friends that I love them. Not that I havent told them ever before but I would regret not telling them enoughYou? ,"same. and how much i appreciate themYour	   house,	   containing	   everything	   you	   own,	   catches	   fire.	   After	   saving	   your	   loved	   ones	   and	    pets,	   you	   have	   time	   to	    safely	   make	   a	   final	   dash	   to	   save	   any	   one	   item.	   What	   would	   it	   be?	    Why? ",this blanket I have that my dad gave me when I was adopted.  I sleep with it every nightyou? ,"jajai have a blanket too! but i would take a box i have with memoriesOf	   all	   the	   people	   in	   your	   family, whose	   death	   would	   you	   find	   most	   disturbin why? ",my mothersshe is so supportive of me and helps me through everything. you? ,my brothers.. because he is the youngest.. and Iv always taken care of him,NA,NA,NA,NA,NA,NA,NA,NA,NA,NA,NA,NA,NA,NA,NA,NA,NA,NA,NA,NA,NA,NA,NA,NA,NA,NA,NA,NA,NA,NA,NA,NA,NA,NA,NA,NA,NA,NA,NA,NA,NA,NA,NA,NA,NA,NA,NA,NA,NA,NA,NA,NA,NA,NA,NA,NA,NA,NA,NA,NA,NA,NA,NA,NA,NA,NA,NA,NA,NA,NA,NA,NA,NA,NA,NA,NA,NA,NA,NA,NA,NA,NA,NA,NA,NA,NA,NA,NA,NA,NA,NA,NA,NA,NA,NA,NA,NA,NA,NA,NA,NA,NA,NA,NA,NA,NA,NA,NA,NA,NA,NA,NA,NA,NA,NA,NA
3,20,R_2WvxJ3Nkipuvil4,R_2z6p5ffcVReCh0m,"Given	   the	   choice	    of	   anyone	   in	   the	   world,	   whom	   would	   you	   want	   as	   a	   dinne dinner guest? Given the choice of anyone in the world, whom would you want as a dinner guest? ","I would probably want to have dinner with Elon MuskWhat  would  constitute  a  ""perfect""  day  for you? ","I wake up at around 8 and jog around, lift weights and cook a large and filling breakfast. i make some music, read a book and play some PS4 before lunch. I head to a cafe after lunch and start working on one of my many projects until dinner time, finishing up with dinner with my girlfriend and a nice romantic night in.If you were able to live to the age of 90 and retain either the mind or body of a 30-year-old for the last 60 years of your life, which would you want? ",NA,NA,NA,NA,NA,NA,NA,NA,NA,NA,NA,NA,NA,NA,NA,NA,NA,NA,NA,NA,NA,NA,NA,NA,NA,NA,NA,NA,NA,NA,NA,NA,NA,NA,NA,NA,NA,NA,NA,NA,NA,NA,NA,NA,NA,NA,NA,NA,NA,NA,NA,NA,NA,NA,NA,NA,NA,NA,NA,NA,NA,NA,NA,NA,NA,NA,NA,NA,NA,NA,NA,NA,NA,NA,NA,NA,NA,NA,NA,NA,NA,NA,NA,NA,NA,NA,NA,NA,NA,NA,NA,NA,NA,NA,NA,NA,NA,NA,NA,NA,NA,NA,NA,NA,NA,NA,NA,NA,NA,NA,NA,NA,NA,NA,NA,NA,NA,NA,NA,NA,NA,NA,NA,NA,NA,NA,NA,NA,NA,NA,NA,NA,NA,NA,NA,NA,NA,NA,NA,NA,NA,NA,NA,NA,NA,NA,NA
4,25,R_1IARPKM3wjMsmcG,R_2widhsX43tqzzbL,"Given the choice of anyone in the world, whom would you want as a dinner guest? ","Barack Obama,maybe? Mostly to see how he deals with all of the pressure and what's he's learned.What would constitute a ""perfect day"" for you? ","Either being able to sleep all day or being able to travel to a different countryIf you were able to live to the age of 90 and retain either the mind or body of a 30-year-old for the last 60 years of your life, which would you want? ","The body. I'd want the wisdom of getting older.If you could change anything about the way you were raised, what would it be? ","Haha sameI wouldn't want to change anything about the way I was raised, but probably the location. The place I grew up was pretty boring. If you could wake up tomorrow having gained any one quality or ability, what would it be? ","It's probably cliche, but I'd like to be able to fly. I like the view from large heights, and I'd be able to save a lot of money on plane tix.If a crystal ball could tell you the truth about yourself, your life, the future, or anything else, what would you want to know? ","i'd want to know where i'd be 5 years from now in terms of where i'd be working, if i'd have a family, stuff like thatwhat is the greatest accomplishment of your life? ","My friend and I organized an event once that raised $9000 for sponsoring polio vaccinations, which cost about $0.60 each. We figure we ended up helping a lot of people.What is your most treasured memory? ","I went on a trip with my family to Italy 5 years ago and my dad fell off the gondola and he lost his favorite pair of sunglasses which sucked but we laughed about it for hours and I remember everyone in my family being so happyIf you knew that in one year you would die suddenly, would you change anything about the way you are living now? ","That's a fun memory (: I'd drop everything, spend time with my closest friends and family, and start seeing as much of the world as I can.How do you feel about your relationship with your mother? ",Haha same I was just thinking the first thing I would do is drop out of schoolI love my mom to death but she can be a little overprotective so sometimes I have to choose what to tell her and what to hold back Share an embarrasing moment in your life? ,"Back in my hometown I crossed the street when it said not to. It was the busiest intersection in the city and I ended up causing a traffic jam, lol.",LOL that's hilarious,When did you last cry in front of another person? By yourself?,"Cried in front of another person yesterday, by myself a few weeks agoIf you were to die this evening with no opportunity to communicate with anyone, what would you most regret not having told someone? Why haven't you told them yet? ","I'd tell my dad I love him, that he's my greatest inspiration and role model, and that I appreciate everything he's done for me. He wasn't around much when I was younger so we're not as affectionate as my mom and I are.Your house, containing everything you know, catches fire. After saving your loved ones and pets, you make a final dash to save only one item. What would it be? ","I have a box in my closet with every birthday card I've ever gotten since I was a kid and with a ton of photos and other memories, so I'd get that.Of all the people in your family, whose death would you find most disturbing? Why? ","My mom's, because she's my best friendIt was good chatting with you! ",Same with you!,NA,NA,NA,NA,NA,NA,NA,NA,NA,NA,NA,NA,NA,NA,NA,NA,NA,NA,NA,NA,NA,NA,NA,NA,NA,NA,NA,NA,NA,NA,NA,NA,NA,NA,NA,NA,NA,NA,NA,NA,NA,NA,NA,NA,NA,NA,NA,NA,NA,NA,NA,NA,NA,NA,NA,NA,NA,NA,NA,NA,NA,NA,NA,NA,NA,NA,NA,NA,NA,NA,NA,NA,NA,NA,NA,NA,NA,NA,NA,NA,NA,NA,NA,NA,NA,NA,NA,NA,NA,NA,NA,NA,NA,NA,NA,NA,NA,NA,NA,NA,NA,NA,NA,NA,NA,NA,NA,NA,NA,NA,NA,NA,NA,NA,NA,NA,NA,NA,NA,NA,NA,NA,NA,NA,NA,NA,NA,NA,NA,NA,NA
